{
  "name": "WebhookSubscription",
  "module": "svc_infra.webhooks.service",
  "docstring": null,
  "parameters": [
    {
      "name": "topic",
      "type": "str",
      "default": null,
      "description": null,
      "required": true
    },
    {
      "name": "url",
      "type": "str",
      "default": null,
      "description": null,
      "required": true
    },
    {
      "name": "secret",
      "type": "str",
      "default": null,
      "description": null,
      "required": true
    },
    {
      "name": "id",
      "type": "str",
      "default": "(lambda: uuid4().hex)()",
      "description": null,
      "required": false
    }
  ],
  "methods": [
    {
      "name": "__init__",
      "signature": "(topic: str, url: str, secret: str, id: str = (lambda: uuid4().hex)()) -> None",
      "docstring": null,
      "parameters": [
        {
          "name": "self",
          "type": null,
          "default": null,
          "description": null,
          "required": false
        },
        {
          "name": "topic",
          "type": "str",
          "default": null,
          "description": null,
          "required": true
        },
        {
          "name": "url",
          "type": "str",
          "default": null,
          "description": null,
          "required": true
        },
        {
          "name": "secret",
          "type": "str",
          "default": null,
          "description": null,
          "required": true
        },
        {
          "name": "id",
          "type": "str",
          "default": "(lambda: uuid4().hex)()",
          "description": null,
          "required": false
        }
      ],
      "returns": "None",
      "is_async": false
    }
  ],
  "bases": []
}
