{
  "name": "HealthCheck",
  "module": "svc_infra.health",
  "docstring": "Registered health check with metadata.",
  "parameters": [
    {
      "name": "name",
      "type": "str",
      "default": null,
      "description": null,
      "required": true
    },
    {
      "name": "check_fn",
      "type": "HealthCheckFn",
      "default": null,
      "description": null,
      "required": true
    },
    {
      "name": "critical",
      "type": "bool",
      "default": "True",
      "description": null,
      "required": false
    },
    {
      "name": "timeout",
      "type": "float",
      "default": "5.0",
      "description": null,
      "required": false
    }
  ],
  "methods": [
    {
      "name": "__init__",
      "signature": "(name: str, check_fn: HealthCheckFn, critical: bool = True, timeout: float = 5.0) -> None",
      "docstring": null,
      "parameters": [
        {
          "name": "self",
          "type": null,
          "default": null,
          "description": null,
          "required": false
        },
        {
          "name": "name",
          "type": "str",
          "default": null,
          "description": null,
          "required": true
        },
        {
          "name": "check_fn",
          "type": "HealthCheckFn",
          "default": null,
          "description": null,
          "required": true
        },
        {
          "name": "critical",
          "type": "bool",
          "default": "True",
          "description": null,
          "required": false
        },
        {
          "name": "timeout",
          "type": "float",
          "default": "5.0",
          "description": null,
          "required": false
        }
      ],
      "returns": "None",
      "is_async": false
    }
  ],
  "bases": []
}
