{
  "name": "DefaultAuthPolicy",
  "module": "svc_infra.api.fastapi.auth.policy",
  "docstring": "Default authentication policy implementation.\n\nChecks user-level MFA settings and provides no-op hooks for login\nand challenge events. Override this class to customize MFA logic,\naudit logging, or add tenant/global policy rules.\n\nAttributes:\n    settings: Application settings for auth configuration.",
  "parameters": [
    {
      "name": "settings",
      "type": null,
      "default": null,
      "description": null,
      "required": true
    }
  ],
  "methods": [
    {
      "name": "__init__",
      "signature": "(settings)",
      "docstring": null,
      "parameters": [
        {
          "name": "self",
          "type": null,
          "default": null,
          "description": null,
          "required": false
        },
        {
          "name": "settings",
          "type": null,
          "default": null,
          "description": null,
          "required": true
        }
      ],
      "returns": null,
      "is_async": false
    },
    {
      "name": "on_login_success",
      "signature": "(user: Any) -> None",
      "docstring": null,
      "parameters": [
        {
          "name": "self",
          "type": null,
          "default": null,
          "description": null,
          "required": false
        },
        {
          "name": "user",
          "type": "Any",
          "default": null,
          "description": null,
          "required": true
        }
      ],
      "returns": "None",
      "is_async": false
    },
    {
      "name": "on_mfa_challenge",
      "signature": "(user: Any) -> None",
      "docstring": null,
      "parameters": [
        {
          "name": "self",
          "type": null,
          "default": null,
          "description": null,
          "required": false
        },
        {
          "name": "user",
          "type": "Any",
          "default": null,
          "description": null,
          "required": true
        }
      ],
      "returns": "None",
      "is_async": false
    },
    {
      "name": "should_require_mfa",
      "signature": "(user: Any) -> bool",
      "docstring": null,
      "parameters": [
        {
          "name": "self",
          "type": null,
          "default": null,
          "description": null,
          "required": false
        },
        {
          "name": "user",
          "type": "Any",
          "default": null,
          "description": null,
          "required": true
        }
      ],
      "returns": "bool",
      "is_async": false
    }
  ],
  "bases": []
}
