{
  "name": "SqlResource",
  "module": "svc_infra.db.sql.resource",
  "docstring": null,
  "parameters": [
    {
      "name": "model",
      "type": "type[object]",
      "default": null,
      "description": null,
      "required": true
    },
    {
      "name": "prefix",
      "type": "str",
      "default": null,
      "description": null,
      "required": true
    },
    {
      "name": "tags",
      "type": "list[str] | None",
      "default": "None",
      "description": null,
      "required": false
    },
    {
      "name": "id_attr",
      "type": "str",
      "default": "'id'",
      "description": null,
      "required": false
    },
    {
      "name": "soft_delete",
      "type": "bool",
      "default": "False",
      "description": null,
      "required": false
    },
    {
      "name": "search_fields",
      "type": "list[str] | None",
      "default": "None",
      "description": null,
      "required": false
    },
    {
      "name": "ordering_default",
      "type": "str | None",
      "default": "None",
      "description": null,
      "required": false
    },
    {
      "name": "allowed_order_fields",
      "type": "list[str] | None",
      "default": "None",
      "description": null,
      "required": false
    },
    {
      "name": "read_schema",
      "type": "type | None",
      "default": "None",
      "description": null,
      "required": false
    },
    {
      "name": "create_schema",
      "type": "type | None",
      "default": "None",
      "description": null,
      "required": false
    },
    {
      "name": "update_schema",
      "type": "type | None",
      "default": "None",
      "description": null,
      "required": false
    },
    {
      "name": "read_name",
      "type": "str | None",
      "default": "None",
      "description": null,
      "required": false
    },
    {
      "name": "create_name",
      "type": "str | None",
      "default": "None",
      "description": null,
      "required": false
    },
    {
      "name": "update_name",
      "type": "str | None",
      "default": "None",
      "description": null,
      "required": false
    },
    {
      "name": "create_exclude",
      "type": "tuple[str, ...]",
      "default": "('id',)",
      "description": null,
      "required": false
    },
    {
      "name": "service_factory",
      "type": "Callable[[SqlRepository], SqlService] | None",
      "default": "None",
      "description": null,
      "required": false
    },
    {
      "name": "tenant_field",
      "type": "str | None",
      "default": "None",
      "description": null,
      "required": false
    }
  ],
  "methods": [
    {
      "name": "__init__",
      "signature": "(model: type[object], prefix: str, tags: list[str] | None = None, id_attr: str = 'id', soft_delete: bool = False, search_fields: list[str] | None = None, ordering_default: str | None = None, allowed_order_fields: list[str] | None = None, read_schema: type | None = None, create_schema: type | None = None, update_schema: type | None = None, read_name: str | None = None, create_name: str | None = None, update_name: str | None = None, create_exclude: tuple[str, ...] = ('id',), service_factory: Callable[[SqlRepository], SqlService] | None = None, tenant_field: str | None = None) -> None",
      "docstring": null,
      "parameters": [
        {
          "name": "self",
          "type": null,
          "default": null,
          "description": null,
          "required": false
        },
        {
          "name": "model",
          "type": "type[object]",
          "default": null,
          "description": null,
          "required": true
        },
        {
          "name": "prefix",
          "type": "str",
          "default": null,
          "description": null,
          "required": true
        },
        {
          "name": "tags",
          "type": "list[str] | None",
          "default": "None",
          "description": null,
          "required": false
        },
        {
          "name": "id_attr",
          "type": "str",
          "default": "'id'",
          "description": null,
          "required": false
        },
        {
          "name": "soft_delete",
          "type": "bool",
          "default": "False",
          "description": null,
          "required": false
        },
        {
          "name": "search_fields",
          "type": "list[str] | None",
          "default": "None",
          "description": null,
          "required": false
        },
        {
          "name": "ordering_default",
          "type": "str | None",
          "default": "None",
          "description": null,
          "required": false
        },
        {
          "name": "allowed_order_fields",
          "type": "list[str] | None",
          "default": "None",
          "description": null,
          "required": false
        },
        {
          "name": "read_schema",
          "type": "type | None",
          "default": "None",
          "description": null,
          "required": false
        },
        {
          "name": "create_schema",
          "type": "type | None",
          "default": "None",
          "description": null,
          "required": false
        },
        {
          "name": "update_schema",
          "type": "type | None",
          "default": "None",
          "description": null,
          "required": false
        },
        {
          "name": "read_name",
          "type": "str | None",
          "default": "None",
          "description": null,
          "required": false
        },
        {
          "name": "create_name",
          "type": "str | None",
          "default": "None",
          "description": null,
          "required": false
        },
        {
          "name": "update_name",
          "type": "str | None",
          "default": "None",
          "description": null,
          "required": false
        },
        {
          "name": "create_exclude",
          "type": "tuple[str, ...]",
          "default": "('id',)",
          "description": null,
          "required": false
        },
        {
          "name": "service_factory",
          "type": "Callable[[SqlRepository], SqlService] | None",
          "default": "None",
          "description": null,
          "required": false
        },
        {
          "name": "tenant_field",
          "type": "str | None",
          "default": "None",
          "description": null,
          "required": false
        }
      ],
      "returns": "None",
      "is_async": false
    }
  ],
  "bases": []
}
