{
  "name": "WebhookService",
  "module": "svc_infra.webhooks.service",
  "docstring": null,
  "parameters": [
    {
      "name": "outbox",
      "type": "OutboxStore",
      "default": null,
      "description": null,
      "required": true
    },
    {
      "name": "subs",
      "type": "InMemoryWebhookSubscriptions",
      "default": null,
      "description": null,
      "required": true
    }
  ],
  "methods": [
    {
      "name": "__init__",
      "signature": "(outbox: OutboxStore, subs: InMemoryWebhookSubscriptions)",
      "docstring": null,
      "parameters": [
        {
          "name": "self",
          "type": null,
          "default": null,
          "description": null,
          "required": false
        },
        {
          "name": "outbox",
          "type": "OutboxStore",
          "default": null,
          "description": null,
          "required": true
        },
        {
          "name": "subs",
          "type": "InMemoryWebhookSubscriptions",
          "default": null,
          "description": null,
          "required": true
        }
      ],
      "returns": null,
      "is_async": false
    },
    {
      "name": "publish",
      "signature": "(topic: str, payload: dict, version: int = 1) -> int",
      "docstring": null,
      "parameters": [
        {
          "name": "self",
          "type": null,
          "default": null,
          "description": null,
          "required": false
        },
        {
          "name": "topic",
          "type": "str",
          "default": null,
          "description": null,
          "required": true
        },
        {
          "name": "payload",
          "type": "dict",
          "default": null,
          "description": null,
          "required": true
        },
        {
          "name": "version",
          "type": "int",
          "default": "1",
          "description": null,
          "required": false
        }
      ],
      "returns": "int",
      "is_async": false
    }
  ],
  "bases": []
}
